ZONE;ACRONYM;NAME;DATE;MEMBERS;ACTORS;TYPE;ROLE;THEME.I;THEME.II;THEME.III;HQ.Country;Description;HOMEPAGE;lon;lat
4;BCF;BioCarbon Fund;2004;16;Public/Firm;Hybrid;4;Climate finance;;;United States of America;Public-private sector initiative mobilizing financing to help develop projects that sequester or conserve carbon in forest and agro-ecosystems. It has been a pioneer in this sector, developing the infrastructure needed to pilot transactions and paving the way for the growing land-use carbon market established to date.;https://wbcarbonfinance.org/Router.cfm?Page=BioCF&ItemID=9708&FID=9708;-95.712891;37.09024
4;C4C;UN Global Compact Caring for Climate;2007;3;Public;Public;1;Carbon pricing and trading;;;United States of America;UN Global Compact, UNEP and the secretariat of the UNFCCC’s initiative to advance the role of business in addressing climate change. It provides a framework for business leaders to implement practical climate change solutions and help shape public policy.;http://caringforclimate.org/;-95.712891;37.09024
4;CDCF;Community Development Carbon Fund;2003;25;Public/Firm;Hybrid;4;Climate finance;;;United States of America;Multi-donor Trust Fund/public-private partnership administered by the World Bank, extends the benefits of carbon finance to the poorest countries and poor communities in all developing countries, which would otherwise find it difficult to attract carbon finance because of country and financial risk. Contributors to the CDCF support projects that measurably benefit poor communities and their local environment and will receive in return, verified Kyoto-compliant emission reductions from these projects.;;-95.712891;37.09024
4;GGFRP;Global Gas Flaring Reduction Partnership;2002;34;Public/Firm;Hybrid;8;Energy Efficiency;;;United States of America;The Global Gas Flaring Reduction Partnership (GGFR) is a public-private initiative comprising international and national oil companies, national and regional governments, and international institutions. GGFR works to increase use of natural gas associated with oil production by helping remove technical and regulatory barriers to flaring reduction, conducting research, disseminating best practices, and developing country-specific gas flaring reduction programs.;http://www.worldbank.org/en/programs/gasflaringreduction;-95.712891;37.09024
4;PCF;Prototype Carbon Fund;2000;22;Public/Firm;Hybrid;4;Climate finance;;;United States of America;Partnership between 17 companies and 6 governments, managed by the World Bank, as the first carbon fund, its mission is to pioneer the market for project-based greenhouse gas emission reductions while promoting sustainable development and offering a learning-by-doing opportunity to its stakeholders. ;;-95.712891;37.09024
4;TCG_MP;The Climate Group (Member Principles);2004;150;Public/Firm;Hybrid;3;Mitigation (general);;;;The TCGs Membership Principles are a set of principles around which the TCG members need to adhere. For example by “Demonstrate our low carbon leadership by focusing our activities in a way that contributes to reducing emissions in the short, medium and long term.” (principle 1);http://www.theclimategroup.org/who-we-are/our-members/our-member-principles/;NA;NA
6;RN!;Refrigerants, Naturally!;2004;5;CSO/Firm;Private;3;Non-CO2 GHGs;;;Germany;Initiative of international companies taking action against global warming and ozone layer depletion. They replace harmful greenhouse gases in our point-of-sales cooling and freezing units with climate-friendly natural refrigerants. The goal is to make them the preferred cooling technology – in a safe, reliable and cost effective manner.;http://www.refrigerantsnaturally.com/;10.451526;51.165691
6;WWF;WWF Climate Savers;1999;22;CSO/Firm;Private;1;Mitigation (general);;;Switzerland;Climate leadership program that seeks to transform businesses into leaders of the low-carbon economy. Its intention is to inspire a change in thinking about climate solutions in companies and as agents of change within their sphere of influence. This leaves member companies better placed to avoid carbon-related risks while realizing opportunities within their long-term business strategies.;http://climatesavers.org/;8.227512;46.818188
6;CDP;Carbon Disclosure Project;2000;1;CSO/Firm;Private;8;MRV;;;United Kingdom;Largest collection globally of self-reported climate change, water and forest-risk data through their global system companies, investors and cities are better able to mitigate risk, capitalize on opportunities and make investment decisions that drive action towards a more sustainable world.;;-3.435973;55.378051
6;CDSB;Climate Disclosure Standards Board;2007;9;CSO/Firm;Private;1;MRV;;;United Kingdom;International consortium of business and environmental organizations committed to the integration of climate change-related information into mainstream corporate reporting. It advances its mission by acting as a forum for collaboration on how existing standards and practices can be supported and enhanced so as to link financial and climate change-related reporting and respond to regulatory developments.;http://www.cdsb.net/;-3.435973;55.378051
6;BELC;Pew Business Environmental Leadership Council;1998;30;CSO/Firm;Private;8;Mitigation (general);;;United States of America;Largest U.S.-based group of corporations focused on addressing the challenges of climate change and supporting mandatory climate policy. It is comprised of industry leading, mostly Fortune 500 companies across a range of sectors. Many different sectors are represented, from high technology to diversified manufacturing, from oil and gas to transportation, from utilities to chemicals.;;-95.712891;37.09024
6;PROT;Greenhouse Gas Protocol;1998;2;CSO/Firm;Private;1;MRV;;;United States of America;Developed by World Resources Institute and World Business Council on Sustainable Development, sets the global standard for how to measure, manage, and report greenhouse gas emissions. Hundreds of companies and organizations around the world are using GHG Protocol standards and tools to manage their emissions and become more efficient, resilient, and prosperous organizations.;http://www.ghgprotocol.org/;-95.712891;37.09024
6;RE100;RE100;2014;2;Firm;Private;1;Renewable Energy;;;;RE100 contributes to global GHG mitigation through encouragin its members from the private sector to go shift their electricity supply to 100% renewable energy sources.  For companies that are not ready for this commitment RE100 helps overcome barriers and develop transparent reporting schemes.;http://there100.org/;NA;NA
7;REEEP;Renewable Energy and Energy Efficiency Partnership ;2002;354;Public/CSO/Firm;Hybrid;4;Renewable Energy;Renewable Energy;;Austria;It invests in clean energy markets in developing countries to reduce CO2 emissions and build prosperity. Based on a strategic portfolio of high impact projects, it works to generate energy access, improve lives and economic opportunities, build sustainable markets, and combat climate change.;http://www.reeep.org/;14.550072;47.516231
7;SE4ALL;Sustainable Energy for All;2011;2;Public/CSO/Firm;Hybrid;1;Renewable Energy;Energy Efficiency;Energy Access;Austria;Global initiative that brings together top-level leadership from all sectors of society – governments, business and civil society - to mobilize action from all sectors of society in support of three interlinked objectives: providing universal access to modern energy services, doubling the global rate of improvement in energy efficiency, and doubling the share of renewable energy in the global energy mix.;http://www.se4all.org/;14.550072;47.516231
7;SLoCaT;Partnership on Sustainable Low Carbon Transport;2009;94;Public/CSO/Firm;Hybrid;3;Sectoral;Transport;;China;Multi-stakeholder partnership of over 80 organizations (representing UN organizations, Multilateral and Bilateral development organizations, NGOs and Foundations, Academe and the Business Sector). It is a Type II Partnership under the UN, meaning that it is a non-legal and non-binding partnership, established to provide a global voice on Sustainable Transport.;http://www.slocat.net/;104.195397;35.86166
7;CCAC;Climate and Clean Air Coalition to Reduce Short-Lived Climate Pollutants;2012;111;Public/CSO/Firm;Hybrid;6;Non-CO2 GHGs;;;France;First global effort to address short-lived climate pollutants (SLCPs) as an urgent and collective challenge, it is a voluntary international framework for concrete and substantial action, aims to reduce emissions of methane, black carbon, and many hydrofluorocarbons (HFCs) in order to protect the environment and public health, promote food and energy security and address near-term climate change. ;;2.213749;46.227638
7;EnLight;En.Lighten ;2009;6;Public/CSO/Firm;Hybrid;6;Sectoral;Lighting;;France;Initiative by UNEP and GEF to accelerate a global market transformation to environmentally sustainable, energy efficient lighting technologies, as well as to develop strategies to phase-out inefficient incandescent lamps to reduce CO2 emissions and the release of mercury from fossil fuel combustion. It serves as a platform to build synergies among international stakeholders, identify global best practices and share this knowledge and information, create policy and regulatory frameworks, address technical and quality issues, and encourage countries to develop National and/or Regional Efficient Lighting Strategies.;;2.213749;46.227638
7;REN21;The Renewable Energy Policy Network for the 21st Century;2005;52;Public/CSO/Firm;Hybrid;3;Renewable Energy;;;France;Global renewable energy policy multi-stakeholder network that connects a wide range of key actors from Governments, International organizations, Industry associations and Science and academia as well as civil society, to facilitate knowledge exchange, policy development and joint action towards a rapid global transition to renewable energy. It promotes renewable energy to meet the needs of both industrialized and developing countries that are driven by climate change, energy security, development and poverty alleviation.;http://www.ren21.net/;2.213749;46.227638
7;U4E;United for Efficiency;2010;18;Public/CSO/Firm;Hybrid;3;Energy Efficiency;;;France;U4E contributes to climate governance by encouraging global markets to switch to more energy efficient lighting, equipment and appliances. The institution works under the SE4ALL initiative;http://united4efficiency.org/;2.213749;46.227638
7;UEMI;Urban Electric Mobility Initiative;2014;20;Public/CSO/Firm;Hybrid;3;Sectoral;Transport;Renewable Energy;Germany;UEMI aims at phasing out conventional vehicles to be replaced by at least 30% electric vehicles by 2030. Further, UEMI aims to widen the concept of urban sustainability and a 30% GHG emissions reduction in urban areas  by 2030. In doing so UEMI is also developing tools to integrate e-mobility into society, to make a 2 degree pathway and to assess the impact of electric vehicles.;http://www.uemi.net/;10.451526;51.165691
7;GACSA;Global Alliance for Climate-Smart Agriculture;2014;117;Public/CSO/Firm;Hybrid;3;Sectoral;Agriculture;;Italy;The Global Alliance for Climate-Smart Agriculture is a voluntary alliance of partners, dedicated to addressing the challenges facing food security and agriculture by tapping the wealth and diversity of resources, knowledge, information and expertise, from and between its members, in order to stimulate concrete initiatives at all levels;http://www.fao.org/gacsa/en/;12.56738;41.87194
7;GBEP;Global Bioenergy Partnership;2007;37;Public/CSO/Firm;Hybrid;6;Renewable Energy;;;Italy;Partnership that brings together public, private and civil society stakeholders in a joint commitment to promote bioenergy for sustainable development. It focuses its activities in three strategic areas: sustainable development, climate change and food and energy security.;http://www.globalbioenergy.org/;12.56738;41.87194
7;L&G;Lean and Green;2008;1;Public/CSO/Firm;Hybrid;8;Sectoral;Transport;;Netherlands;L&G has developed a simulation that encourage companies and government bodies to reduce their carbon footprint through taking cost saving measures. Furthermore, the institution provides awards to companies that prove they can reduce emission by 20% over 5 years, and a star upon completion.;http://lean-green.nl/en-GB/home/;5.291266;52.132633
7;EnergyPlus;International Energy and Climate Initiative;2010;43;Public/CSO/Firm;Hybrid;4;Energy Access;;;Norway;Led by the Norwegian Ministry of Foreign Affairs, the overarching purpose of the Energy+ Initiative is to contribute to providing access to efficient energy services to all by increased development of renewable energy and energy efficiency, and to mitigate energy’s impacts on climate. It is an open partnership engaging, in particular countries in the developing world.;https://www.regjeringen.no/en/topics/foreign-affairs/development-cooperation/energy_plus/id672635/;8.468946;60.472024
7;PDC;Portfolio Decarbonization Coalition;2014;4;Public/CSO/Firm;Hybrid;6;Climate finance;;;Switzerland;Multi-stakeholder initiative that will drive GHG emissions reductions on the ground by mobilizing a critical mass of institutional investors committed to gradually decarbonizing their portfolios. ;http://unepfi.org/pdc/;8.227512;46.818188
7;RSB;The Roundtable on Sustainable Biofuels (RSB Standard);2007;93;Public/CSO/Firm;Hybrid;1;Renewable Energy;;;Switzerland;International multi-stakeholder initiative that brings together farmers, companies, non-governmental organizations, experts, governments, and inter-governmental agencies concerned with ensuring the sustainability of biomass and biomaterial production and processing. Their certification system is based on sustainability standards encompassing environmental, social and economic principles and criteria.;http://rsb.org/;8.227512;46.818188
7;UNEP-FI;UNEP Finance Initiative ;2003;217;Public/CSO/Firm;Hybrid;8;Climate finance;;;Switzerland;Global partnership between UNEP and the financial sector. Over 200 institutions, including banks, insurers and fund managers, work with UNEP to understand the impacts of environmental and social considerations on financial performance.;http://www.unepfi.org/;8.227512;46.818188
7;INCR;Investor Network on Climate Risk;2003;118;CSO/Firm/Public;Hybrid;3;Climate finance;;;United States of America;Network of more than 110 institutional investors representing more than $13 trillion in assets committed to addressing the risks and seizing the opportunities resulting from climate change and other sustainability challenges. ;http://www.ceres.org/investor-network/incr;-95.712891;37.09024
7;LEDS GP;Low Emission Development Strategies Global Partnership;2011;27;Public/CSO/Firm;Hybrid;3;Energy Access;Renewable Energy;;United States of America;LEDS GP aims at reducing GHG emissions while also increasing resilience towards climate change impacts. It does so by linking practitioners and policymakers in regional platforms and work groups that promote low emission development strategies. It has six workgroups working on topics including Agriculture and Forestry, Energy, Finance and transportation.;http://www.ledsgp.org/;-95.712891;37.09024
7;NCM;Networked Carbon Markets Initiative;2013;1;Public/CSO/Firm;Hybrid;3;Carbon pricing and trading;;;United States of America;"Through the Networked Carbon Markets Initiative, the World Bank Group is convening civil society, governments and the private sector to develop a framework for assessing climate mitigation efforts and infrastructure to support carbon market related functions. The end-goal is to facilitate linking or ""networking"" of heterogeneous carbon markets so that the linked markets will have greater liquidity and deliver climate-smart financing more efficiently.";http://www.worldbank.org/en/topic/climatechange/brief/globally-networked-carbon-markets;-95.712891;37.09024
7;FCPF;Forest Carbon Partnership Facility;2008;62;Public;Public;10;Forest;;;United States of America;Global partnership of governments, businesses, civil society, and Indigenous Peoples focused on reducing emissions from deforestation and forest degradation, forest carbon stock conservation, the sustainable management of forests, and the enhancement of forest carbon stocks in developing countries (activities commonly referred to as REDD+). It has two separate but complementary funding mechanisms – the Readiness Fund and the Carbon Fund.;https://www.forestcarbonpartnership.org/;-95.712891;37.09024
7;CUD;Connected Urban Development;2006;2;Public/Firm;Hybrid;3;Urban climate action;;;United States of America;It demonstrates how to reduce carbon emissions by introducing fundamental improvements in the efficiency of urban infrastructure through information and communications technology. It was born from Cisco's commitment to the Clinton Global Initiative to participate in helping reduce carbon emissions.;http://www.cisco.com/web/about/ac79/ps/cud/about.html;-95.712891;37.09024
7;DI;Divest-Invest Global Movement;2014;41;Public/CSO/Firm;Hybrid;3;Climate finance;;;;DI encourage inventors across the public and private sectors and across different types of funds to divest from fossil fuel industries and promote a clean energy future. In 2015 DI represented over 500 organizations and $3.4 trillion. ;http://divestinvest.org/;NA;NA
7;CSR;Compact of States and Regions;2015;4;CSP/Private/Public;Hybrid;1;Urban climate action;MRV;;;CSR is a reporting scheme for states and provinces for tracking climate mitigation efforts. The institution contributes to global climate governance through an annual assessment on global efforts (on the state and provincial level) taken to tackle climate change.;http://www.theclimategroup.org/what-we-do/programs/compact-of-states-and-regions/;NA;NA
